training/results/singler/combined_result.csv

Distribution,In-Distribution,In-Distribution,In-Distribution,In-Distribution,In-Distribution,In-Distribution,In-Distribution,In-Distribution,In-Distribution,In-Distribution,In-Distribution,In-Distribution,In-Distribution,In-Distribution,In-Distribution,In-Distribution,In-Distribution,In-Distribution,In-Distribution,In-Distribution,In-Distribution,In-Distribution,In-Distribution,In-Distribution,In-Distribution,In-Distribution,In-Distribution,In-Distribution,In-Distribution,In-Distribution,In-Distribution,In-Distribution,In-Distribution,In-Distribution,In-Distribution,In-Distribution,In-Distribution,In-Distribution,In-Distribution,In-Distribution,In-Distribution,In-Distribution,In-Distribution,In-Distribution,In-Distribution,In-Distribution,In-Distribution,In-Distribution,In-Distribution,Out-of-Distribution,Out-of-Distribution,Out-of-Distribution,Out-of-Distribution,Out-of-Distribution,Out-of-Distribution,Out-of-Distribution,Out-of-Distribution,Out-of-Distribution,Out-of-Distribution,Out-of-Distribution,Out-of-Distribution,Out-of-Distribution,Out-of-Distribution,Out-of-Distribution,Out-of-Distribution,Out-of-Distribution,Out-of-Distribution,Out-of-Distribution,Out-of-Distribution,Out-of-Distribution,Out-of-Distribution,Out-of-Distribution,Out-of-Distribution,Out-of-Distribution,Out-of-Distribution,Out-of-Distribution,Out-of-Distribution,Out-of-Distribution,Out-of-Distribution,Out-of-Distribution,Out-of-Distribution,Out-of-Distribution,Out-of-Distribution,Out-of-Distribution,Out-of-Distribution,Out-of-Distribution,Out-of-Distribution,Out-of-Distribution,Out-of-Distribution,Out-of-Distribution,Out-of-Distribution,Out-of-Distribution,Out-of-Distribution,Out-of-Distribution,Out-of-Distribution,Out-of-Distribution,Out-of-Distribution,Out-of-Distribution,All,All
Category,Baseline,Classification Report,Classification Report,Classification Report,Classification Report,Classification Report,Classification Report,Classification Report,Classification Report,Classification Report,Classification Report,Classification Report,Classification Report,Classification Report,Classification Report,Classification Report,Classification Report,Classification Report,Classification Report,Classification Report,Classification Report,Classification Report,Classification Report,Classification Report,Classification Report,Classification Report,Classification Report,Classification Report,Classification Report,Classification Report,Classification Report,Classification Report,Classification Report,Classification Report,Classification Report,Classification Report,Classification Report,Classification Report,Classification Report,Classification Report,Classification Report,Classification Report,Dropout,Consistency,Consistency,Dropout,Dropout,Dropout,Dropout,Baseline,Classification Report,Classification Report,Classification Report,Classification Report,Classification Report,Classification Report,Classification Report,Classification Report,Classification Report,Classification Report,Classification Report,Classification Report,Classification Report,Classification Report,Classification Report,Classification Report,Classification Report,Classification Report,Classification Report,Classification Report,Classification Report,Classification Report,Classification Report,Classification Report,Classification Report,Classification Report,Classification Report,Classification Report,Classification Report,Classification Report,Classification Report,Classification Report,Classification Report,Classification Report,Classification Report,Classification Report,Classification Report,Classification Report,Classification Report,Classification Report,Classification Report,Dropout,Consistency,Consistency,Dropout,Dropout,Dropout,Dropout,Technical_Metrics,Technical_Metrics
Sub-Category,Overall,B cell,B cell,B cell,B cell,CD14+ monocyte,CD14+ monocyte,CD14+ monocyte,CD14+ monocyte,CD4+ T cell,CD4+ T cell,CD4+ T cell,CD4+ T cell,Cytotoxic T cell,Cytotoxic T cell,Cytotoxic T cell,Cytotoxic T cell,Dendritic cell,Dendritic cell,Dendritic cell,Dendritic cell,Megakaryocyte,Megakaryocyte,Megakaryocyte,Megakaryocyte,Natural killer cell,Natural killer cell,Natural killer cell,Natural killer cell,Plasma cell,Plasma cell,Plasma cell,Plasma cell,Total_Accuracy,macro avg,macro avg,macro avg,macro avg,weighted avg,weighted avg,weighted avg,weighted avg,Random,Num Samples,Inconsistent Predictions,FI_0.1%,FI_0.5%,FI_1.0%,FI_2.0%,Overall,B cell,B cell,B cell,B cell,CD14+ monocyte,CD14+ monocyte,CD14+ monocyte,CD14+ monocyte,CD4+ T cell,CD4+ T cell,CD4+ T cell,CD4+ T cell,Cytotoxic T cell,Cytotoxic T cell,Cytotoxic T cell,Cytotoxic T cell,Dendritic cell,Dendritic cell,Dendritic cell,Dendritic cell,Megakaryocyte,Megakaryocyte,Megakaryocyte,Megakaryocyte,Natural killer cell,Natural killer cell,Natural killer cell,Natural killer cell,Plasma cell,Plasma cell,Plasma cell,Plasma cell,Total_Accuracy,macro avg,macro avg,macro avg,macro avg,weighted avg,weighted avg,weighted avg,weighted avg,Random,Num Samples,Inconsistent Predictions,FI_0.1%,FI_0.5%,FI_1.0%,FI_2.0%,Resource_Usage,Resource_Usage
Metric,Accuracy,precision,recall,f1-score,support,precision,recall,f1-score,support,precision,recall,f1-score,support,precision,recall,f1-score,support,precision,recall,f1-score,support,precision,recall,f1-score,support,precision,recall,f1-score,support,precision,recall,f1-score,support,accuracy,precision,recall,f1-score,support,precision,recall,f1-score,support,score,Count,Count,Accuracy,Accuracy,Accuracy,Accuracy,Accuracy,precision,recall,f1-score,support,precision,recall,f1-score,support,precision,recall,f1-score,support,precision,recall,f1-score,support,precision,recall,f1-score,support,precision,recall,f1-score,support,precision,recall,f1-score,support,precision,recall,f1-score,support,accuracy,precision,recall,f1-score,support,precision,recall,f1-score,support,score,Count,Count,Accuracy,Accuracy,Accuracy,Accuracy,Total_Pipeline_Time_Min,Peak_RAM_GB
0,0.9716625363646159,1.0,1.0,1.0,120.0,1.0,0.9984466019417476,0.9992226972405752,2575.0,0.9940506983962752,0.9828644501278773,0.9884259259259259,3910.0,0.9401756311745335,0.9391447368421053,0.9396599012616567,1824.0,0.5,0.4,0.4444444444444444,5.0,1.0,1.0,1.0,7.0,0.8467933491686461,0.9013906447534766,0.8732394366197183,791.0,1.0,1.0,1.0,49.0,0.9716625363646159,0.9101274598424318,0.9027308042081508,0.9056240506865401,9281.0,0.9724094516953112,0.9716625363646159,0.9719467829171999,9281.0,0.9693136515461698,9281,0,0.9618575584527529,0.9390151923284129,0.9112164637431311,0.8701648529253313,0.7761678051473125,0.999242615501136,0.9997474109623642,0.9994949494949495,3959.0,0.9346073454762616,0.9984051036682615,0.9654534238124615,3135.0,0.9973480011786662,0.7431206088992974,0.8516670161459425,13664.0,0.4363438520130577,0.9944203347799132,0.6065418793722821,4839.0,0.9421965317919075,0.6162570888468809,0.7451428571428571,529.0,0.9558823529411765,0.7558139534883721,0.8441558441558441,86.0,1.0,0.010905125408942203,0.021574973031283712,2751.0,1.0,1.0,1.0,23.0,0.7761678051473125,0.9082025873627757,0.764833703256754,0.7542538678944526,28986.0,0.8962897391328373,0.7761678051473125,0.7626116737886647,28986.0,0.7730525081073621,28986,0,0.7789622576416201,0.794176498999517,0.7973504450424342,0.8015248740771407,6.97,12.087409973144531
0,0.9716625363646159,1.0,1.0,1.0,120.0,1.0,0.9984466019417476,0.9992226972405752,2575.0,0.9940506983962752,0.9828644501278773,0.9884259259259259,3910.0,0.9401756311745335,0.9391447368421053,0.9396599012616567,1824.0,0.5,0.4,0.4444444444444444,5.0,1.0,1.0,1.0,7.0,0.8467933491686461,0.9013906447534766,0.8732394366197183,791.0,1.0,1.0,1.0,49.0,0.9716625363646159,0.9101274598424318,0.9027308042081508,0.9056240506865401,9281.0,0.9724094516953112,0.9716625363646159,0.9719467829171999,9281.0,0.9685917465790321,9281,0,0.9618575584527529,0.9390151923284129,0.9112164637431311,0.8701648529253313,0.7761678051473125,0.999242615501136,0.9997474109623642,0.9994949494949495,3959.0,0.9346073454762616,0.9984051036682615,0.9654534238124615,3135.0,0.9973480011786662,0.7431206088992974,0.8516670161459425,13664.0,0.4363438520130577,0.9944203347799132,0.6065418793722821,4839.0,0.9421965317919075,0.6162570888468809,0.7451428571428571,529.0,0.9558823529411765,0.7558139534883721,0.8441558441558441,86.0,1.0,0.010905125408942203,0.021574973031283712,2751.0,1.0,1.0,1.0,23.0,0.7761678051473125,0.9082025873627757,0.764833703256754,0.7542538678944526,28986.0,0.8962897391328373,0.7761678051473125,0.7626116737886647,28986.0,0.7682536396881253,28986,0,0.7789622576416201,0.794176498999517,0.7973504450424342,0.8015248740771407,5.63,12.087409973144531
0,0.9716625363646159,1.0,1.0,1.0,120.0,1.0,0.9984466019417476,0.9992226972405752,2575.0,0.9940506983962752,0.9828644501278773,0.9884259259259259,3910.0,0.9401756311745335,0.9391447368421053,0.9396599012616567,1824.0,0.5,0.4,0.4444444444444444,5.0,1.0,1.0,1.0,7.0,0.8467933491686461,0.9013906447534766,0.8732394366197183,791.0,1.0,1.0,1.0,49.0,0.9716625363646159,0.9101274598424318,0.9027308042081508,0.9056240506865401,9281.0,0.9724094516953112,0.9716625363646159,0.9719467829171999,9281.0,0.9660920159465576,9281,0,0.9618575584527529,0.9390151923284129,0.9112164637431311,0.8701648529253313,0.7761678051473125,0.999242615501136,0.9997474109623642,0.9994949494949495,3959.0,0.9346073454762616,0.9984051036682615,0.9654534238124615,3135.0,0.9973480011786662,0.7431206088992974,0.8516670161459425,13664.0,0.4363438520130577,0.9944203347799132,0.6065418793722821,4839.0,0.9421965317919075,0.6162570888468809,0.7451428571428571,529.0,0.9558823529411765,0.7558139534883721,0.8441558441558441,86.0,1.0,0.010905125408942203,0.021574973031283712,2751.0,1.0,1.0,1.0,23.0,0.7761678051473125,0.9082025873627757,0.764833703256754,0.7542538678944526,28986.0,0.8962897391328373,0.7761678051473125,0.7626116737886647,28986.0,0.7761057062029945,28986,0,0.7789622576416201,0.794176498999517,0.7973504450424342,0.8015248740771407,5.55,12.087409973144531
0,0.9716625363646159,1.0,1.0,1.0,120.0,1.0,0.9984466019417476,0.9992226972405752,2575.0,0.9940506983962752,0.9828644501278773,0.9884259259259259,3910.0,0.9401756311745335,0.9391447368421053,0.9396599012616567,1824.0,0.5,0.4,0.4444444444444444,5.0,1.0,1.0,1.0,7.0,0.8467933491686461,0.9013906447534766,0.8732394366197183,791.0,1.0,1.0,1.0,49.0,0.9716625363646159,0.9101274598424318,0.9027308042081508,0.9056240506865401,9281.0,0.9724094516953112,0.9716625363646159,0.9719467829171999,9281.0,0.9667600474086845,9281,0,0.9618575584527529,0.9390151923284129,0.9112164637431311,0.8701648529253313,0.7761678051473125,0.999242615501136,0.9997474109623642,0.9994949494949495,3959.0,0.9346073454762616,0.9984051036682615,0.9654534238124615,3135.0,0.9973480011786662,0.7431206088992974,0.8516670161459425,13664.0,0.4363438520130577,0.9944203347799132,0.6065418793722821,4839.0,0.9421965317919075,0.6162570888468809,0.7451428571428571,529.0,0.9558823529411765,0.7558139534883721,0.8441558441558441,86.0,1.0,0.010905125408942203,0.021574973031283712,2751.0,1.0,1.0,1.0,23.0,0.7761678051473125,0.9082025873627757,0.764833703256754,0.7542538678944526,28986.0,0.8962897391328373,0.7761678051473125,0.7626116737886647,28986.0,0.7644759539087835,28986,0,0.7789622576416201,0.794176498999517,0.7973504450424342,0.8015248740771407,5.6,12.087409973144531
0,0.9716625363646159,1.0,1.0,1.0,120.0,1.0,0.9984466019417476,0.9992226972405752,2575.0,0.9940506983962752,0.9828644501278773,0.9884259259259259,3910.0,0.9401756311745335,0.9391447368421053,0.9396599012616567,1824.0,0.5,0.4,0.4444444444444444,5.0,1.0,1.0,1.0,7.0,0.8467933491686461,0.9013906447534766,0.8732394366197183,791.0,1.0,1.0,1.0,49.0,0.9716625363646159,0.9101274598424318,0.9027308042081508,0.9056240506865401,9281.0,0.9724094516953112,0.9716625363646159,0.9719467829171999,9281.0,0.9690658334231225,9281,0,0.9618575584527529,0.9390151923284129,0.9112164637431311,0.8701648529253313,0.7761678051473125,0.999242615501136,0.9997474109623642,0.9994949494949495,3959.0,0.9346073454762616,0.9984051036682615,0.9654534238124615,3135.0,0.9973480011786662,0.7431206088992974,0.8516670161459425,13664.0,0.4363438520130577,0.9944203347799132,0.6065418793722821,4839.0,0.9421965317919075,0.6162570888468809,0.7451428571428571,529.0,0.9558823529411765,0.7558139534883721,0.8441558441558441,86.0,1.0,0.010905125408942203,0.021574973031283712,2751.0,1.0,1.0,1.0,23.0,0.7761678051473125,0.9082025873627757,0.764833703256754,0.7542538678944526,28986.0,0.8962897391328373,0.7761678051473125,0.7626116737886647,28986.0,0.7823949492858622,28986,0,0.7789622576416201,0.794176498999517,0.7973504450424342,0.8015248740771407,5.49,12.087409973144531
0,0.9716625363646159,1.0,1.0,1.0,120.0,1.0,0.9984466019417476,0.9992226972405752,2575.0,0.9940506983962752,0.9828644501278773,0.9884259259259259,3910.0,0.9401756311745335,0.9391447368421053,0.9396599012616567,1824.0,0.5,0.4,0.4444444444444444,5.0,1.0,1.0,1.0,7.0,0.8467933491686461,0.9013906447534766,0.8732394366197183,791.0,1.0,1.0,1.0,49.0,0.9716625363646159,0.9101274598424318,0.9027308042081508,0.9056240506865401,9281.0,0.9724094516953112,0.9716625363646159,0.9719467829171999,9281.0,0.9684947742700141,9281,0,0.9618575584527529,0.9390151923284129,0.9112164637431311,0.8701648529253313,0.7761678051473125,0.999242615501136,0.9997474109623642,0.9994949494949495,3959.0,0.9346073454762616,0.9984051036682615,0.9654534238124615,3135.0,0.9973480011786662,0.7431206088992974,0.8516670161459425,13664.0,0.4363438520130577,0.9944203347799132,0.6065418793722821,4839.0,0.9421965317919075,0.6162570888468809,0.7451428571428571,529.0,0.9558823529411765,0.7558139534883721,0.8441558441558441,86.0,1.0,0.010905125408942203,0.021574973031283712,2751.0,1.0,1.0,1.0,23.0,0.7761678051473125,0.9082025873627757,0.764833703256754,0.7542538678944526,28986.0,0.8962897391328373,0.7761678051473125,0.7626116737886647,28986.0,0.7718312288691093,28986,0,0.7789622576416201,0.794176498999517,0.7973504450424342,0.8015248740771407,5.5,12.087409973144531
0,0.9716625363646159,1.0,1.0,1.0,120.0,1.0,0.9984466019417476,0.9992226972405752,2575.0,0.9940506983962752,0.9828644501278773,0.9884259259259259,3910.0,0.9401756311745335,0.9391447368421053,0.9396599012616567,1824.0,0.5,0.4,0.4444444444444444,5.0,1.0,1.0,1.0,7.0,0.8467933491686461,0.9013906447534766,0.8732394366197183,791.0,1.0,1.0,1.0,49.0,0.9716625363646159,0.9101274598424318,0.9027308042081508,0.9056240506865401,9281.0,0.9724094516953112,0.9716625363646159,0.9719467829171999,9281.0,0.9698416118952699,9281,0,0.9618575584527529,0.9390151923284129,0.9112164637431311,0.8701648529253313,0.7761678051473125,0.999242615501136,0.9997474109623642,0.9994949494949495,3959.0,0.9346073454762616,0.9984051036682615,0.9654534238124615,3135.0,0.9973480011786662,0.7431206088992974,0.8516670161459425,13664.0,0.4363438520130577,0.9944203347799132,0.6065418793722821,4839.0,0.9421965317919075,0.6162570888468809,0.7451428571428571,529.0,0.9558823529411765,0.7558139534883721,0.8441558441558441,86.0,1.0,0.010905125408942203,0.021574973031283712,2751.0,1.0,1.0,1.0,23.0,0.7761678051473125,0.9082025873627757,0.764833703256754,0.7542538678944526,28986.0,0.8962897391328373,0.7761678051473125,0.7626116737886647,28986.0,0.772121023942593,28986,0,0.7789622576416201,0.794176498999517,0.7973504450424342,0.8015248740771407,5.49,12.087409973144531
0,0.9716625363646159,1.0,1.0,1.0,120.0,1.0,0.9984466019417476,0.9992226972405752,2575.0,0.9940506983962752,0.9828644501278773,0.9884259259259259,3910.0,0.9401756311745335,0.9391447368421053,0.9396599012616567,1824.0,0.5,0.4,0.4444444444444444,5.0,1.0,1.0,1.0,7.0,0.8467933491686461,0.9013906447534766,0.8732394366197183,791.0,1.0,1.0,1.0,49.0,0.9716625363646159,0.9101274598424318,0.9027308042081508,0.9056240506865401,9281.0,0.9724094516953112,0.9716625363646159,0.9719467829171999,9281.0,0.9683870272599936,9281,0,0.9618575584527529,0.9390151923284129,0.9112164637431311,0.8701648529253313,0.7761678051473125,0.999242615501136,0.9997474109623642,0.9994949494949495,3959.0,0.9346073454762616,0.9984051036682615,0.9654534238124615,3135.0,0.9973480011786662,0.7431206088992974,0.8516670161459425,13664.0,0.4363438520130577,0.9944203347799132,0.6065418793722821,4839.0,0.9421965317919075,0.6162570888468809,0.7451428571428571,529.0,0.9558823529411765,0.7558139534883721,0.8441558441558441,86.0,1.0,0.010905125408942203,0.021574973031283712,2751.0,1.0,1.0,1.0,23.0,0.7761678051473125,0.9082025873627757,0.764833703256754,0.7542538678944526,28986.0,0.8962897391328373,0.7761678051473125,0.7626116737886647,28986.0,0.7795521976126406,28986,0,0.7789622576416201,0.794176498999517,0.7973504450424342,0.8015248740771407,5.61,12.087409973144531
0,0.9716625363646159,1.0,1.0,1.0,120.0,1.0,0.9984466019417476,0.9992226972405752,2575.0,0.9940506983962752,0.9828644501278773,0.9884259259259259,3910.0,0.9401756311745335,0.9391447368421053,0.9396599012616567,1824.0,0.5,0.4,0.4444444444444444,5.0,1.0,1.0,1.0,7.0,0.8467933491686461,0.9013906447534766,0.8732394366197183,791.0,1.0,1.0,1.0,49.0,0.9716625363646159,0.9101274598424318,0.9027308042081508,0.9056240506865401,9281.0,0.9724094516953112,0.9716625363646159,0.9719467829171999,9281.0,0.9657795496174982,9281,0,0.9618575584527529,0.9390151923284129,0.9112164637431311,0.8701648529253313,0.7761678051473125,0.999242615501136,0.9997474109623642,0.9994949494949495,3959.0,0.9346073454762616,0.9984051036682615,0.9654534238124615,3135.0,0.9973480011786662,0.7431206088992974,0.8516670161459425,13664.0,0.4363438520130577,0.9944203347799132,0.6065418793722821,4839.0,0.9421965317919075,0.6162570888468809,0.7451428571428571,529.0,0.9558823529411765,0.7558139534883721,0.8441558441558441,86.0,1.0,0.010905125408942203,0.021574973031283712,2751.0,1.0,1.0,1.0,23.0,0.7761678051473125,0.9082025873627757,0.764833703256754,0.7542538678944526,28986.0,0.8962897391328373,0.7761678051473125,0.7626116737886647,28986.0,0.7757641620092459,28986,0,0.7789622576416201,0.794176498999517,0.7973504450424342,0.8015248740771407,5.59,12.087409973144531
0,0.9716625363646159,1.0,1.0,1.0,120.0,1.0,0.9984466019417476,0.9992226972405752,2575.0,0.9940506983962752,0.9828644501278773,0.9884259259259259,3910.0,0.9401756311745335,0.9391447368421053,0.9396599012616567,1824.0,0.5,0.4,0.4444444444444444,5.0,1.0,1.0,1.0,7.0,0.8467933491686461,0.9013906447534766,0.8732394366197183,791.0,1.0,1.0,1.0,49.0,0.9716625363646159,0.9101274598424318,0.9027308042081508,0.9056240506865401,9281.0,0.9724094516953112,0.9716625363646159,0.9719467829171999,9281.0,0.9669539920267212,9281,0,0.9618575584527529,0.9390151923284129,0.9112164637431311,0.8701648529253313,0.7761678051473125,0.999242615501136,0.9997474109623642,0.9994949494949495,3959.0,0.9346073454762616,0.9984051036682615,0.9654534238124615,3135.0,0.9973480011786662,0.7431206088992974,0.8516670161459425,13664.0,0.4363438520130577,0.9944203347799132,0.6065418793722821,4839.0,0.9421965317919075,0.6162570888468809,0.7451428571428571,529.0,0.9558823529411765,0.7558139534883721,0.8441558441558441,86.0,1.0,0.010905125408942203,0.021574973031283712,2751.0,1.0,1.0,1.0,23.0,0.7761678051473125,0.9082025873627757,0.764833703256754,0.7542538678944526,28986.0,0.8962897391328373,0.7761678051473125,0.7626116737886647,28986.0,0.7707617470503002,28986,0,0.7789622576416201,0.794176498999517,0.7973504450424342,0.8015248740771407,5.6,12.087409973144531
mean,0.9716625363646157,1.0,1.0,1.0,120.0,1.0,0.9984466019417477,0.9992226972405753,2575.0,0.9940506983962752,0.9828644501278772,0.9884259259259259,3910.0,0.9401756311745334,0.9391447368421055,0.9396599012616565,1824.0,0.5,0.4,0.4444444444444445,5.0,1.0,1.0,1.0,7.0,0.8467933491686461,0.9013906447534767,0.8732394366197183,791.0,1.0,1.0,1.0,49.0,0.9716625363646157,0.9101274598424318,0.9027308042081508,0.9056240506865402,9281.0,0.9724094516953112,0.9716625363646157,0.9719467829172,9281.0,0.9679280249973063,9281.0,0.0,0.9618575584527529,0.9390151923284128,0.9112164637431311,0.8701648529253314,0.7761678051473125,0.9992426155011358,0.9997474109623642,0.9994949494949494,3959.0,0.9346073454762618,0.9984051036682615,0.9654534238124614,3135.0,0.9973480011786663,0.7431206088992974,0.8516670161459425,13664.0,0.4363438520130577,0.9944203347799133,0.606541879372282,4839.0,0.9421965317919077,0.6162570888468809,0.7451428571428572,529.0,0.9558823529411764,0.7558139534883722,0.8441558441558442,86.0,1.0,0.010905125408942203,0.021574973031283716,2751.0,1.0,1.0,1.0,23.0,0.7761678051473125,0.9082025873627758,0.7648337032567539,0.7542538678944526,28986.0,0.8962897391328374,0.7761678051473125,0.7626116737886647,28986.0,0.7734313116677016,28986.0,0.0,0.7789622576416201,0.7941764989995171,0.7973504450424344,0.8015248740771407,5.703000000000001,12.087409973144531
std,1.1702778228589004e-16,0.0,0.0,0.0,0.0,0.0,1.1702778228589004e-16,1.1702778228589004e-16,0.0,0.0,1.1702778228589004e-16,0.0,0.0,1.1702778228589004e-16,2.340555645717801e-16,1.1702778228589004e-16,0.0,0.0,0.0,5.851389114294502e-17,0.0,0.0,0.0,0.0,0.0,0.0,1.1702778228589004e-16,0.0,0.0,0.0,0.0,0.0,0.0,1.1702778228589004e-16,0.0,0.0,1.1702778228589004e-16,0.0,0.0,1.1702778228589004e-16,1.1702778228589004e-16,0.0,0.0014200385551702136,0.0,0.0,0.0,1.1702778228589004e-16,0.0,1.1702778228589004e-16,0.0,2.340555645717801e-16,0.0,1.1702778228589004e-16,0.0,2.340555645717801e-16,0.0,1.1702778228589004e-16,0.0,1.1702778228589004e-16,0.0,0.0,0.0,0.0,1.1702778228589004e-16,1.1702778228589004e-16,0.0,1.1702778228589004e-16,0.0,1.1702778228589004e-16,0.0,1.1702778228589004e-16,1.1702778228589004e-16,1.1702778228589004e-16,0.0,0.0,0.0,3.657118196434064e-18,0.0,0.0,0.0,0.0,0.0,0.0,1.1702778228589004e-16,1.1702778228589004e-16,0.0,0.0,1.1702778228589004e-16,0.0,0.0,0.0,0.005259494345510741,0.0,0.0,0.0,1.1702778228589004e-16,1.1702778228589004e-16,0.0,0.4482819053527218,0.0
mean +- std,0.9717 +- 0.0,1.0 +- 0.0,1.0 +- 0.0,1.0 +- 0.0,120.0 +- 0.0,1.0 +- 0.0,0.9984 +- 0.0,0.9992 +- 0.0,2575.0 +- 0.0,0.9941 +- 0.0,0.9829 +- 0.0,0.9884 +- 0.0,3910.0 +- 0.0,0.9402 +- 0.0,0.9391 +- 0.0,0.9397 +- 0.0,1824.0 +- 0.0,0.5 +- 0.0,0.4 +- 0.0,0.4444 +- 0.0,5.0 +- 0.0,1.0 +- 0.0,1.0 +- 0.0,1.0 +- 0.0,7.0 +- 0.0,0.8468 +- 0.0,0.9014 +- 0.0,0.8732 +- 0.0,791.0 +- 0.0,1.0 +- 0.0,1.0 +- 0.0,1.0 +- 0.0,49.0 +- 0.0,0.9717 +- 0.0,0.9101 +- 0.0,0.9027 +- 0.0,0.9056 +- 0.0,9281.0 +- 0.0,0.9724 +- 0.0,0.9717 +- 0.0,0.9719 +- 0.0,9281.0 +- 0.0,0.9679 +- 0.0014,9281.0 +- 0.0,0.0 +- 0.0,0.9619 +- 0.0,0.939 +- 0.0,0.9112 +- 0.0,0.8702 +- 0.0,0.7762 +- 0.0,0.9992 +- 0.0,0.9997 +- 0.0,0.9995 +- 0.0,3959.0 +- 0.0,0.9346 +- 0.0,0.9984 +- 0.0,0.9655 +- 0.0,3135.0 +- 0.0,0.9973 +- 0.0,0.7431 +- 0.0,0.8517 +- 0.0,13664.0 +- 0.0,0.4363 +- 0.0,0.9944 +- 0.0,0.6065 +- 0.0,4839.0 +- 0.0,0.9422 +- 0.0,0.6163 +- 0.0,0.7451 +- 0.0,529.0 +- 0.0,0.9559 +- 0.0,0.7558 +- 0.0,0.8442 +- 0.0,86.0 +- 0.0,1.0 +- 0.0,0.0109 +- 0.0,0.0216 +- 0.0,2751.0 +- 0.0,1.0 +- 0.0,1.0 +- 0.0,1.0 +- 0.0,23.0 +- 0.0,0.7762 +- 0.0,0.9082 +- 0.0,0.7648 +- 0.0,0.7543 +- 0.0,28986.0 +- 0.0,0.8963 +- 0.0,0.7762 +- 0.0,0.7626 +- 0.0,28986.0 +- 0.0,0.7734 +- 0.0053,28986.0 +- 0.0,0.0 +- 0.0,0.779 +- 0.0,0.7942 +- 0.0,0.7974 +- 0.0,0.8015 +- 0.0,5.703 +- 0.4483,12.0874 +- 0.0

training/results/old_or_unused_results/singler_home_directory/robustness_report.md

Random dropout accuracy score 0.9679 +- 0.0014
Total samples: 9281.0 +- 0.0
Number of inconsistent predictions: 0.0 +- 0.0
Feature importance dropout (0.1% features dropped) accuracy score 0.9619 +- 0.0
Feature importance dropout (0.5% features dropped) accuracy score 0.939 +- 0.0
Feature importance dropout (1.0% features dropped) accuracy score 0.9112 +- 0.0
Feature importance dropout (2.0% features dropped) accuracy score 0.8702 +- 0.0
--- Out of data distribution ---
Genes expected in training set: 10000
Genes actually matched in test set: 8693
Training data Max-Value: 8.634057
Test data Max-Value: 8.726716041564941
Baseline accuracy score 0.7762 +- 0.0

Random dropout accuracy score 0.7695 +- 0.0065
Total samples: 28986.0 +- 0.0
Number of inconsistent predictions: 0.0 +- 0.0
Feature importance dropout (0.1% features dropped) accuracy score 0.779 +- 0.0
Feature importance dropout (0.5% features dropped) accuracy score 0.7942 +- 0.0
Feature importance dropout (1.0% features dropped) accuracy score 0.7974 +- 0.0
Feature importance dropout (2.0% features dropped) accuracy score 0.8015 +- 0.0